{
  "meta": {
    "task_id": "20260209T085750Z_compute_stage_demo",
    "skill": "compute_numerical",
    "backend": "python",
    "timestamp_utc": "2026-02-09T08:57:53Z",
    "status": "ok"
  },
  "params": {
    "alpha": 1.25,
    "beta": 0.75,
    "rtol": 1e-08,
    "atol": 1e-10
  },
  "results": {
    "summary": "Computed affine transform over grid.",
    "grid": [
      0.0,
      1.0,
      2.0,
      3.0,
      4.0,
      5.0
    ],
    "values": [
      0.75,
      2.0,
      3.25,
      4.5,
      5.75,
      7.0
    ],
    "mean": 3.875
  },
  "sanity_checks": [
    {
      "name": "length_match",
      "pass": true,
      "value": 6,
      "note": "grid/value lengths"
    },
    {
      "name": "finite_values",
      "pass": true,
      "value": true,
      "note": "all outputs finite"
    },
    {
      "name": "monotonic_values",
      "pass": true,
      "value": true,
      "note": "expected with positive alpha"
    }
  ],
  "diagnostics": {
    "convergence": "not_applicable",
    "stability": {
      "rtol": 1e-08,
      "atol": 1e-10,
      "note": "deterministic closed-form evaluation"
    }
  }
}